{
  "$schema": "https://json-schema.org/draft/2020-12/schema",
  "$id": "data/schemas/exo-vessel-ftl-q-lattice-technical-volume.schema.json",
  "title": "Black Light Q-Lattice Phase Translation Technical Volume",
  "type": "object",
  "required": [
    "schema_version",
    "family",
    "authority",
    "mathematics",
    "path_progression",
    "machinery",
    "power",
    "navigation_control",
    "operation",
    "maintenance",
    "signatures",
    "failures",
    "infrastructure",
    "scaling",
    "technology_basis",
    "generator_api",
    "provenance"
  ],
  "properties": {
    "schema_version": {"type": "string"},
    "family": {"const": "q-lattice"},
    "authority": {"type": "object"},
    "mathematics": {"type": "object"},
    "path_progression": {"type": "array", "minItems": 7, "maxItems": 7},
    "machinery": {"type": "object"},
    "power": {"type": "object"},
    "navigation_control": {"type": "object"},
    "operation": {"type": "object"},
    "maintenance": {"type": "object"},
    "signatures": {"type": "object"},
    "failures": {"type": "object"},
    "infrastructure": {"type": "object"},
    "scaling": {"type": "object"},
    "technology_basis": {"type": "array", "minItems": 7},
    "generator_api": {"type": "object"},
    "provenance": {"type": "object"}
  },
  "additionalProperties": true
}