{
  "schema_version": "1.0.0",
  "family": "q-lattice",
  "authority": {
    "status": "MIXED",
    "primary": "docs/blacklight/BLACK_LIGHT_PROPULSION_TRANSIT_AUTHORITY.md",
    "legacy_design_source": {
      "title": "The different lightspeed methods",
      "provider": "google-drive",
      "id": "1e0Xp71EFubBZgXWjjvPxAqPoJIZNwqS6nu1-r7Kil7Y",
      "revisionId": "ANLCKQllC5h6dLaX5H1RpK8aUFVWsi-IV7gbMHUd0Qq7mIe5uGsLFi5_Hrsr8B6dl8t_ezB0fTSygxrnIBtifAHW79bgSbswp1zF3NaEil0",
      "status": "CONFIRMED"
    },
    "family_sources": [
      "data/exo-vessel/ftl-development-lineage-registry.json",
      "data/exo-vessel/ftl-calibration-registry.json",
      "data/exo-vessel/ftl-environment-regression-registry.json",
      "data/exo-vessel/ftl-family-basis-embodiment-registry.json",
      "data/exo-vessel/ftl-technical-corpus-registry.json",
      "EXO_OPERATIVE_TECHNOLOGY_BASIS.md"
    ],
    "rule": "Confirmed family identity, physical action, recovered Path implementation names, named race/manufacturer systems and adopted setting facts outrank this derived volume. New equations and generic machinery consequences are DERIVED. Illustrative thresholds, incidents, institutions, dates, inventors and ownership are PROPOSED or UNRESOLVED."
  },
  "mathematics": {
    "status": "DERIVED",
    "lattice_state": {
      "definition": "Represent the traversable Q structure as a directed time-indexed graph G_Q(t)=(V_Q,E_Q), where each vertex alpha is a quantized Q address and each edge e(alpha,beta,t) is an admissible protected-state translation during a valid phase epoch.",
      "address": "A_Q=(alpha,epoch,frame,reference_set,covariance)",
      "interpretation": "Q-Lattice does not ride a continuous shear and does not shorten a metric. It commits a protected vessel state through one or more indexed discrete Q-address transitions."
    },
    "epoch_validity": {
      "equation": "V_e(alpha,beta,t)=I[address_authenticated]*I[epoch_open]*I[state_coverage_valid]*I[exit_admissible]",
      "rule": "An edge whose epoch closes before commit completion is not partially valid; the solver must reject it or choose a certified fallback.",
      "status": "DERIVED"
    },
    "address_uncertainty": {
      "equation": "Sigma_A=Sigma_ref+Sigma_clock+Sigma_model+Sigma_gravity+Sigma_infrastructure",
      "alias_probability": "P_alias=P(candidate_address maps to unintended physically admissible state | observations,epoch)",
      "guard": "Address confidence must never be represented by one unqualified accuracy percentage; alias structure and covariance remain visible.",
      "status": "DERIVED"
    },
    "route_graph": {
      "equation": "pi*=argmin_pi sum_e[w_t*T_e+w_a*C_address+w_p*C_phase+w_u*C_unc+w_c*C_coverage+w_x*C_exit+w_r*C_recovery]",
      "guard": "Geometric closeness does not imply graph adjacency; a longer ordinary-space route may be a shorter valid lattice path.",
      "status": "DERIVED"
    },
    "phase_clock": {
      "equation": "Delta_phi(t)=integral(omega_drive-omega_epoch)dt+phi_ref_error",
      "validity": "Commit requires |Delta_phi| below the certified family/path envelope for the entire protected volume.",
      "status": "DERIVED"
    },
    "coverage": {
      "equation": "C_Q=min_{x in protected_volume} c(x); valid iff C_Q>=C_min",
      "meaning": "The whole protected state must be addressable coherently. Local uncovered or weakly covered mass is a state-integrity failure, not merely reduced efficiency.",
      "status": "DERIVED"
    },
    "gravity_interaction": {
      "equation": "C_g=f(Phi,gradPhi,curvature,reference_frame_error,address_model)",
      "legacy_alignment": "Strong gravity distorts reference frames, clock solutions and endpoint/address inference, increasing calculation and power burden. Coefficients remain family-specific and are not copied from metric, gravitic or slipstream systems.",
      "status": "DERIVED"
    },
    "safety_horizon": {
      "equation": "N_safe>=N_detect+N_auth+N_solve+N_commit+N_reject+N_recovery",
      "alternate_time_form": "T_lookahead>=t_detect+t_auth+t_solve+t_commit+t_reject+t_recovery+t_margin",
      "meaning": "Because the lattice is discrete, safety is naturally expressed in valid future address/epoch opportunities as well as physical distance.",
      "status": "DERIVED"
    }
  },
  "path_progression": [
    {"path":"P0","implementation":"Q-Cell Addressing Monolith","status":"MIXED","mathematical_capability":"Prove repeatable stable discrete Q addresses exist and can be distinguished from continuous Q-boundary behavior.","physical_enablers":["monumental address resonator","precision clocks","fixed reference lattice"],"operational_result":"No payload translation; establishes discrete address physics."},
    {"path":"P1","implementation":"Molecular Phase Conveyor","status":"MIXED","mathematical_capability":"Map and schedule adjacent address transitions for simple matter states through known phase epochs.","physical_enablers":["small phase cages","epoch clocks","known-address whitelist"],"operational_result":"Microscopic-to-small payload translation."},
    {"path":"P2","implementation":"Macroscopic Lattice Translator","status":"MIXED","mathematical_capability":"Maintain protected-state coverage and identity constraints across complex macroscopic payloads.","physical_enablers":["synchronized cage arrays","state buffers","coverage tomography"],"operational_result":"Macroscopic local jumps with mandatory coverage and identity checks."},
    {"path":"P3","implementation":"INHERIT_FROM_DEVELOPMENT_LINEAGE","status":"DERIVED","mathematical_capability":"Solve autonomous ship-scale address chains across moving reference frames, including destination occupancy and valid future epochs.","physical_enablers":["shipwide address cage","long-baseline reference sensors","authenticated address computer","independent reject reserve"],"operational_result":"First autonomous interstellar Q-Lattice translation. Exact recovered implementation name remains controlled by the lineage registry."},
    {"path":"P4","implementation":"INHERIT_FROM_DEVELOPMENT_LINEAGE","status":"DERIVED","mathematical_capability":"Rank multiple candidate lattice paths under alias, epoch, coverage and failure uncertainty while maintaining sectional protected-state observability.","physical_enablers":["distributed cage sectors","redundant epoch clocks","address-voting mesh","sectional recovery"],"operational_result":"Operational fleet use with graceful rejection of bad address branches."},
    {"path":"P5","implementation":"INHERIT_FROM_DEVELOPMENT_LINEAGE","status":"DERIVED","mathematical_capability":"Use strategic address atlases, beacon histories and predictive epoch models across sparse or changing lattice connectivity.","physical_enablers":["long-look references","authenticated beacon federation","large address cache","predictive graph solver"],"operational_result":"Strategic routing chooses reliable graph connectivity rather than minimum geometric distance."},
    {"path":"P6","implementation":"INHERIT_FROM_DEVELOPMENT_LINEAGE","status":"DERIVED","mathematical_capability":"Continuously co-solve address graph, epoch schedule, protected-state health, vessel frame, destination admissibility and rollback options in a receding-horizon controller.","physical_enablers":["self-calibrating address media","distributed coherent clocks","continuous coverage tomography","fast multi-candidate solvers"],"operational_result":"Apex systems maintain several authenticated future address chains and discard invalidating branches before commit."}
  ],
  "machinery": {
    "blocks": [
      {"id":"address-resonator","function":"Excite, identify and lock a selected quantized Q address without confusing neighboring or aliased states."},
      {"id":"epoch-clock","function":"Maintain phase/time reference for valid translation windows; redundancy must be independently comparable."},
      {"id":"protected-state-cage","function":"Provide coherent address coverage for all translated vessel mass and required fields."},
      {"id":"state-buffer","function":"Hold certified precommit state descriptors, coverage maps and rollback information through commit."},
      {"id":"address-navigation","function":"Authenticate references, construct G_Q, rank candidate paths and reject aliases or closed epochs."},
      {"id":"translation-controller","function":"Sequence address lock, phase alignment, coverage proof, commit, exit verification and recovery."},
      {"id":"termination-recovery","function":"Reject an uncommitted edge or settle post-translation state according to certified family behavior."},
      {"id":"control-thermal-abort-backbone","function":"Maintain clocks, isolation, heat rejection, health voting and emergency commands independently of primary translation energy."}
    ],
    "layout_invariants": [
      "Protected-state coverage follows translated volume, not prime-mover footprint.",
      "Clock/reference paths must be independently testable; one common clock is not redundancy.",
      "P4+ systems require sectional cage health visibility and isolation.",
      "Address authentication and destination occupancy checking are safety machinery, not optional navigation software.",
      "Named race/manufacturer machinery authority overrides generic embodiments when present."
    ]
  },
  "power": {
    "model": "E_commit=E_lock+E_phase+E_coverage+E_translation+E_exit+E_recovery; peak load is dominated by address-lock/commit transients while sensing, clocking and state maintenance persist.",
    "rules": [
      "A beacon may reduce address uncertainty or synchronization burden but cannot supply missing protected-state coverage.",
      "A short graph path is not energy-free; difficult addresses can cost more to authenticate, phase-lock or recover from.",
      "Independent reject/recovery reserve is excluded from discretionary route energy.",